{
  "schema_version": 1,
  "raw_event_id": "raw_01K5R8Z9M6N9V4Z8A3D5F7H9K1",
  "collector": "windows.process",
  "collector_version": "0.0.1",
  "observed_at": "2026-09-18T10:44:03.170Z",
  "source_timestamp": "2026-09-18T10:44:03.114Z",
  "host_id": "host_01K5R8Z9M4Q7T2V6X1B3D5F7H9",
  "boot_id": "boot_01K5R8Z9M4Q7T2V6X1B3D5F7HA",
  "payload_type": "process_exit",
  "payload": {
    "pid": 9812,
    "parent_pid": 4312,
    "name": "notepad.exe",
    "path": "C:\\Windows\\System32\\notepad.exe",
    "process_started_at": "2026-09-18T10:42:15.220Z",
    "exited_at": "2026-09-18T10:44:03.114Z",
    "exit_code": 0
  }
}
